{
  "schemaVersion": 1,
  "id": "apt-clojure",
  "name": "Aptlantis Clojure",
  "mode": "dark",
  "colors": {
    "canvas": [
      0.18339054031764934,
      0.03142321932510305,
      226.51287252927438
    ],
    "background": [
      0.18339054031764934,
      0.03142321932510305,
      226.51287252927438
    ],
    "panel": [
      0.2246629702656747,
      0.021644927844904908,
      222.52471363646677
    ],
    "elevated": [
      0.2627395893860046,
      0.022137326654451957,
      226.43456979288075
    ],
    "accentSurface": [
      0.2246629702656747,
      0.021644927844904908,
      222.52471363646677
    ],
    "border": [
      0.5837089980812344,
      0.10932205800150172,
      160.30605640352076
    ],
    "muted": [
      0.6328326925262192,
      0.10795773219142259,
      160.65373141607304
    ],
    "secondaryText": [
      0.9961963948578669,
      0.003942756951370542,
      106.47095605283538
    ],
    "text": [
      0.9961963948578669,
      0.003942756951370542,
      106.47095605283538
    ],
    "primary": [
      0.8219242579905256,
      0.12686679473410953,
      143.11885163855044
    ],
    "focus": [
      0.8219242579905256,
      0.12686679473410953,
      143.11885163855044
    ],
    "secondary": [
      0.638746935935628,
      0.04228291381574061,
      230.67129305320873
    ],
    "warning": [
      0.9016048068767422,
      0.13067930652531137,
      137.03907536642254
    ],
    "error": [
      0.9016048068767422,
      0.13067930652531137,
      137.03907536642254
    ],
    "success": [
      0.8219242579905256,
      0.12686679473410953,
      143.11885163855044
    ],
    "info": [
      0.7782464016107004,
      0.12011824547143123,
      234.4096881923109
    ],
    "keyword": [
      0.7274240540015344,
      0.12917521552304956,
      157.13850462323433
    ],
    "string": [
      0.638746935935628,
      0.04228291381574061,
      230.67129305320873
    ],
    "number": [
      0.9572061212426071,
      0.0646901171224936,
      138.26062009708752
    ],
    "function": [
      0.6709368792760954,
      0.16821218506171626,
      265.84625657818657
    ],
    "operator": [
      0.6351677647231411,
      0.09396183058798588,
      150.85022823977013
    ],
    "selection": [
      0.29861626815099446,
      0.06885767319774717,
      143.6107730973289
    ],
    "selectionText": [
      0.9961963948578669,
      0.003942756951370542,
      106.47095605283538
    ]
  },
  "provenance": {
    "source": "apt-Clojure/typora/tokens.json",
    "sha256": "a19df38a8a976ee92a09eea5259004faa48f32dc77b549e74ef21df1a50776bc",
    "mapping": "commandwizard-md-v1"
  }
}
