{
  "schemaVersion": 1,
  "id": "apt-crystal",
  "name": "Aptlantis Crystal",
  "mode": "dark",
  "colors": {
    "canvas": [
      0.1944449495696795,
      0.024833410202348964,
      259.24629780341
    ],
    "background": [
      0.1944449495696795,
      0.024833410202348964,
      259.24629780341
    ],
    "panel": [
      0.2336033857304238,
      0.017203935187624284,
      259.75346603543767
    ],
    "elevated": [
      0.2744147752922275,
      0.01717759675382116,
      255.66746091691783
    ],
    "accentSurface": [
      0.2336033857304238,
      0.017203935187624284,
      259.75346603543767
    ],
    "border": [
      0.5878703174443345,
      0.11992029733510841,
      65.9034848226244
    ],
    "muted": [
      0.6578880701031898,
      0.1202664926357037,
      65.74869478870903
    ],
    "secondaryText": [
      0.9970251916618011,
      4.577566798522237e-16,
      0
    ],
    "text": [
      0.9970251916618011,
      4.577566798522237e-16,
      0
    ],
    "primary": [
      0.8865365828648333,
      0.14679770943818365,
      195.90762738741347
    ],
    "focus": [
      0.8865365828648333,
      0.14679770943818365,
      195.90762738741347
    ],
    "secondary": [
      0.6421932391222935,
      0.0808754327082056,
      241.99265986038466
    ],
    "warning": [
      0.8916122196106652,
      0.10982283687210721,
      93.1219579254287
    ],
    "error": [
      0.6578880701031898,
      0.1202664926357037,
      65.74869478870903
    ],
    "success": [
      0.8593755061925293,
      0.22706888087432156,
      143.89437543071193
    ],
    "info": [
      0.6777283897076198,
      0.0624497224709206,
      241.22116557834332
    ],
    "keyword": [
      0.7587846566170595,
      0.13142437571171364,
      70.59574979791435
    ],
    "string": [
      0.6421932391222935,
      0.0808754327082056,
      241.99265986038466
    ],
    "number": [
      0.6664567509565671,
      0.1851945692164377,
      293.6192059961055
    ],
    "function": [
      0.8865365828648333,
      0.14679770943818365,
      195.90762738741347
    ],
    "operator": [
      0.822676599180119,
      0.0534558324770105,
      256.39295398785765
    ],
    "selection": [
      0.30139833720014086,
      0.051448154886584205,
      194.76895989798194
    ],
    "selectionText": [
      0.9970251916618011,
      4.577566798522237e-16,
      0
    ]
  },
  "provenance": {
    "source": "apt-Crystal/typora/tokens.json",
    "sha256": "70a718b0cdcbb0bc8c4a355a64a93787c66c6855e645c80032ad30b7128c3ca4",
    "mapping": "commandwizard-md-v1"
  }
}
